{
  "graph_id": "G-FREE",
  "graph_version": 1,
  "project_id": "P1",
  "goal_id": "GOAL-1",
  "nodes": [
    {
      "node_id": "g",
      "graph_id": "G-FREE",
      "kind": "GOAL",
      "state": "PLANNED"
    },
    {
      "node_id": "t",
      "graph_id": "G-FREE",
      "kind": "TASK",
      "state": "PLANNED",
      "required_capabilities": [
        "graph.core"
      ]
    },
    {
      "node_id": "chk",
      "graph_id": "G-FREE",
      "kind": "DETERMINISTIC_CHECK",
      "state": "PLANNED",
      "required_capabilities": [
        "graph.deterministic_checks"
      ]
    }
  ],
  "edges": [
    {
      "edge_id": "e1",
      "graph_id": "G-FREE",
      "from_node": "g",
      "to_node": "t",
      "edge_class": "PRECEDENCE",
      "precedence_kind": "REQUIRES_ACCEPTED"
    },
    {
      "edge_id": "e2",
      "graph_id": "G-FREE",
      "from_node": "t",
      "to_node": "chk",
      "edge_class": "PRECEDENCE",
      "precedence_kind": "REQUIRES_ACCEPTED"
    }
  ],
  "policy_id": "free.single_runtime",
  "created_at": "2026-08-15T00:00:00Z",
  "context_epoch": 1
}
