{
  "graph_id": "G-LIN",
  "graph_version": 1,
  "project_id": "P1",
  "goal_id": "GOAL-1",
  "nodes": [
    {
      "node_id": "n1",
      "graph_id": "G-LIN",
      "kind": "GOAL",
      "state": "PLANNED"
    },
    {
      "node_id": "n2",
      "graph_id": "G-LIN",
      "kind": "TASK",
      "state": "PLANNED"
    },
    {
      "node_id": "n3",
      "graph_id": "G-LIN",
      "kind": "DETERMINISTIC_CHECK",
      "state": "PLANNED"
    }
  ],
  "edges": [
    {
      "edge_id": "e1",
      "graph_id": "G-LIN",
      "from_node": "n1",
      "to_node": "n2",
      "edge_class": "PRECEDENCE",
      "precedence_kind": "REQUIRES_ACCEPTED"
    },
    {
      "edge_id": "e2",
      "graph_id": "G-LIN",
      "from_node": "n2",
      "to_node": "n3",
      "edge_class": "PRECEDENCE",
      "precedence_kind": "REQUIRES_ACCEPTED"
    }
  ],
  "policy_id": "free.single_runtime",
  "created_at": "2026-08-15T00:00:00Z",
  "context_epoch": 1
}
